{
  "schema_version": "1.0.0",
  "bundle_id": "0e51e94c14da0d6b",
  "cve_id": "CVE-2026-48715",
  "nixpkgs_rev": "0000000000000000000000000000000000000000",
  "policy_version": "0000000000000000000000000000000000000000000000000000000000000000",
  "bundle_schema_sha256": "1111111111111111111111111111111111111111111111111111111111111111",
  "routing_config_sha256": "2222222222222222222222222222222222222222222222222222222222222222",
  "tool_manifest": {
    "flake_lock_sha256": "3333333333333333333333333333333333333333333333333333333333333333",
    "tools": [
      {
        "name": "python",
        "version": "3.13"
      },
      {
        "name": "trace-cli",
        "version": "0.0.0"
      }
    ]
  },
  "cross_family_rule_honored": true,
  "roles": [
    {
      "role": "upstream-ref-resolver",
      "invocations": [
        {
          "invocation_id": "a8ee4f88-8a79-4200-8780-6fba3f6f95c8",
          "role": "upstream-ref-resolver",
          "started_at": "2026-06-12T17:26:32Z",
          "ended_at": "2026-06-12T17:26:32Z",
          "model": {
            "family": "deterministic-no-model",
            "vendor": "internal",
            "model_id": "upstream-ref-resolver-deterministic",
            "version": "1.0.0",
            "sampling": {
              "temperature": 0,
              "top_p": 1,
              "max_tokens": 1
            }
          },
          "prompt": {
            "path": "prompts/upstream-ref-resolver.v1.md",
            "sha256": "7777777777777777777777777777777777777777777777777777777777777777"
          },
          "inputs": [
            {
              "path": "finding.json",
              "sha256": "e10beaecdf107eaf96157e684585791b41dde177b4bc98eb6333751c6a8d5fb7"
            },
            {
              "path": "resolver-input.json",
              "sha256": "5d0f763e419543f799b4debee98de5cd76e64e7d1a60a57bb5f3192842885e7c"
            }
          ],
          "outputs": [
            {
              "path": "upstream-ref.json",
              "sha256": "9640ce34b680962f4f29e9a62429db829551a7dcb6793af11646265b5860e448"
            }
          ],
          "rng_seed": null,
          "validators_passed": [
            "eligibility-verdict-present"
          ],
          "network_policy_applied": "feeds-only"
        }
      ]
    },
    {
      "role": "patcher",
      "invocations": [
        {
          "invocation_id": "eab1a2cb-61d5-4da1-bd2a-cc1e3b81420c",
          "role": "patcher",
          "started_at": "2026-06-12T17:30:24Z",
          "ended_at": "2026-06-12T17:30:42Z",
          "model": {
            "family": "anthropic",
            "vendor": "anthropic",
            "model_id": "claude-opus-4-7",
            "version": "opus-4-7",
            "sampling": {
              "temperature": 0.0,
              "top_p": 1.0,
              "max_tokens": 8192
            }
          },
          "prompt": {
            "path": "prompts/patcher.v2.1.md",
            "sha256": "6cb07d62ed2ac552c8574c7ebe93f9be6419423a2484cbac8159d627b391b803"
          },
          "inputs": [
            {
              "path": "finding.json",
              "sha256": "e10beaecdf107eaf96157e684585791b41dde177b4bc98eb6333751c6a8d5fb7"
            },
            {
              "path": "upstream-ref.json",
              "sha256": "9640ce34b680962f4f29e9a62429db829551a7dcb6793af11646265b5860e448"
            },
            {
              "path": "impact.json",
              "sha256": "13b9526c1f46593a9b4a7cb15885e1abb6401723349182e562e2c42fdede920d"
            },
            {
              "path": "maintainers.json",
              "sha256": "221c08f95bc0a728ad43379bce142ad9d0a4cdfc9774f144b8cd81a2274e370e"
            },
            {
              "path": "package.nix",
              "sha256": "c1f0d0165a3ed27d1cc1b77350ffd98a0aaf4ae40a5afe64e20bc1ef4dbd0ed6"
            }
          ],
          "outputs": [
            {
              "path": "patch.diff",
              "sha256": "0a52e2fa554ecd729665c9bebee7a1ea30b9816f93d7ce0471eb61e6152d50e6"
            },
            {
              "path": "patch-rationale.md",
              "sha256": "8535bba2b3f8b631300fbf68c97974d8be19bc289d065ff71cd46e7985fae8e8"
            }
          ],
          "rng_seed": null,
          "validators_passed": [
            "schema-valid-output"
          ],
          "network_policy_applied": "none"
        }
      ]
    },
    {
      "role": "reviewer",
      "invocations": [
        {
          "invocation_id": "137de566-7cc0-4f1a-a7eb-c2b1a579560c",
          "role": "reviewer",
          "started_at": "2026-06-12T17:33:36Z",
          "ended_at": "2026-06-12T17:33:46Z",
          "model": {
            "family": "anthropic",
            "vendor": "anthropic",
            "model_id": "claude-sonnet-4-6",
            "version": "sonnet-4-6",
            "sampling": {
              "temperature": 0.0,
              "top_p": 1.0,
              "max_tokens": 8192
            }
          },
          "prompt": {
            "path": "prompts/reviewer.v2.md",
            "sha256": "1b089c7e15fe0a4971347cecb0a46c4b330067c14bd19f204faf87b956a6fc68"
          },
          "inputs": [
            {
              "path": "finding.json",
              "sha256": "e10beaecdf107eaf96157e684585791b41dde177b4bc98eb6333751c6a8d5fb7"
            },
            {
              "path": "upstream-ref.json",
              "sha256": "9640ce34b680962f4f29e9a62429db829551a7dcb6793af11646265b5860e448"
            },
            {
              "path": "impact.json",
              "sha256": "13b9526c1f46593a9b4a7cb15885e1abb6401723349182e562e2c42fdede920d"
            },
            {
              "path": "maintainers.json",
              "sha256": "221c08f95bc0a728ad43379bce142ad9d0a4cdfc9774f144b8cd81a2274e370e"
            },
            {
              "path": "package.nix",
              "sha256": "c1f0d0165a3ed27d1cc1b77350ffd98a0aaf4ae40a5afe64e20bc1ef4dbd0ed6"
            },
            {
              "path": "patch.diff",
              "sha256": "0a52e2fa554ecd729665c9bebee7a1ea30b9816f93d7ce0471eb61e6152d50e6"
            },
            {
              "path": "patch-rationale.md",
              "sha256": "8535bba2b3f8b631300fbf68c97974d8be19bc289d065ff71cd46e7985fae8e8"
            }
          ],
          "outputs": [
            {
              "path": "review.md",
              "sha256": "e19246fc7c9af27208fa63be508a035b7e3d4c9a5bca300eea6f6b95732c81bc"
            }
          ],
          "rng_seed": null,
          "validators_passed": [
            "schema-valid-output",
            "attestation-grounded"
          ],
          "network_policy_applied": "none"
        }
      ]
    }
  ]
}
