{
  "schema_version": "1.0.0",
  "bundle_id": "b15f98d1f5a51b7a",
  "cve_id": "CVE-2026-0992",
  "nixpkgs_rev": "41afd44087b55ecebe7608a0195f8f2352281aed",
  "policy_version": "0000000000000000000000000000000000000000000000000000000000000000",
  "bundle_schema_sha256": "1111111111111111111111111111111111111111111111111111111111111111",
  "routing_config_sha256": "2222222222222222222222222222222222222222222222222222222222222222",
  "tool_manifest": {
    "flake_lock_sha256": "3333333333333333333333333333333333333333333333333333333333333333",
    "tools": [
      {
        "name": "python",
        "version": "3.13"
      },
      {
        "name": "trace-cli",
        "version": "0.0.0"
      }
    ]
  },
  "cross_family_rule_honored": true,
  "roles": [
    {
      "role": "upstream-ref-resolver",
      "invocations": [
        {
          "invocation_id": "6ea6158c-086f-4781-84b1-9221ce94fca7",
          "role": "upstream-ref-resolver",
          "started_at": "2026-06-21T03:02:41Z",
          "ended_at": "2026-06-21T03:02:41Z",
          "model": {
            "family": "deterministic-no-model",
            "vendor": "internal",
            "model_id": "upstream-ref-resolver-deterministic",
            "version": "1.0.0",
            "sampling": {
              "temperature": 0,
              "top_p": 1,
              "max_tokens": 1
            }
          },
          "prompt": {
            "path": "prompts/upstream-ref-resolver.v1.md",
            "sha256": "7777777777777777777777777777777777777777777777777777777777777777"
          },
          "inputs": [
            {
              "path": "finding.json",
              "sha256": "3e996f32ed4742e085d4745bd8f9cd207434cedccace69e1fd974e8cf2593466"
            },
            {
              "path": "resolver-input.json",
              "sha256": "812c3b68db2ab08496fae8b71a1ee4796ca00a0623d05a8edda2c2bdaafe6c1d"
            }
          ],
          "outputs": [
            {
              "path": "upstream-ref.json",
              "sha256": "dab79259d5ff5a2c373a3747615b6c96043fec49cf164a29adc644681c4acaaf"
            }
          ],
          "rng_seed": null,
          "validators_passed": [
            "eligibility-verdict-present"
          ],
          "network_policy_applied": "feeds-only"
        }
      ]
    },
    {
      "role": "patcher",
      "invocations": [
        {
          "invocation_id": "b66461b9-4874-49c9-8b82-8bb41d10433a",
          "role": "patcher",
          "started_at": "2026-06-21T03:03:59Z",
          "ended_at": "2026-06-21T03:04:35Z",
          "model": {
            "family": "anthropic",
            "vendor": "anthropic",
            "model_id": "claude-opus-4-7",
            "version": "opus-4-7",
            "sampling": {
              "temperature": 0.0,
              "top_p": 1.0,
              "max_tokens": 8192
            }
          },
          "prompt": {
            "path": "prompts/patcher.v3.md",
            "sha256": "66ee5695e4855a10978974b8c0bf39c3594e408d26ae131ede7d30fa127bfd8c"
          },
          "inputs": [
            {
              "path": "finding.json",
              "sha256": "3e996f32ed4742e085d4745bd8f9cd207434cedccace69e1fd974e8cf2593466"
            },
            {
              "path": "upstream-ref.json",
              "sha256": "dab79259d5ff5a2c373a3747615b6c96043fec49cf164a29adc644681c4acaaf"
            },
            {
              "path": "impact.json",
              "sha256": "2291e62ab6745af3e672caad0f498dce1c3ea0ce378d3559a31e2e6ae2a16855"
            },
            {
              "path": "maintainers.json",
              "sha256": "4f17c0547e7144e9570a17c0ac61541b3f316ba4b8312fa42c5a6ef91da0ff2f"
            },
            {
              "path": "package.nix",
              "sha256": "e013668e2e124d2e87d2ea7fc242fce10d0da594f449fda1b0630b2f297d95be"
            },
            {
              "path": "upstream-fix.patch",
              "sha256": "1cd10aec04211b48e80672a2278a8ae0cfc79b63c38340640d0af83cbb1a4a00"
            }
          ],
          "outputs": [
            {
              "path": "patch.diff",
              "sha256": "3f94e208ed98da1110c98c79db0ce188c1432e5d670f46940b941a38bb3ab59e"
            },
            {
              "path": "patch-rationale.md",
              "sha256": "c0d5d267627b291ffed80672831d87dbb37149c606d284a6dab3cc0aceb7d888"
            }
          ],
          "rng_seed": null,
          "validators_passed": [
            "schema-valid-output"
          ],
          "network_policy_applied": "none"
        }
      ]
    },
    {
      "role": "reviewer",
      "invocations": [
        {
          "invocation_id": "9dc49545-8a14-4412-b031-a02d5b1bfabf",
          "role": "reviewer",
          "started_at": "2026-06-21T03:06:25Z",
          "ended_at": "2026-06-21T03:06:38Z",
          "model": {
            "family": "anthropic",
            "vendor": "anthropic",
            "model_id": "claude-sonnet-4-5-20250929",
            "version": "sonnet-4-5-20250929",
            "sampling": {
              "temperature": 0.0,
              "top_p": 1.0,
              "max_tokens": 8192
            }
          },
          "prompt": {
            "path": "prompts/reviewer.v3.md",
            "sha256": "ef53ac5a2cd7e6ced3f0b96fd922690abe892d8498aec214df693d058f832937"
          },
          "inputs": [
            {
              "path": "finding.json",
              "sha256": "3e996f32ed4742e085d4745bd8f9cd207434cedccace69e1fd974e8cf2593466"
            },
            {
              "path": "upstream-ref.json",
              "sha256": "dab79259d5ff5a2c373a3747615b6c96043fec49cf164a29adc644681c4acaaf"
            },
            {
              "path": "impact.json",
              "sha256": "2291e62ab6745af3e672caad0f498dce1c3ea0ce378d3559a31e2e6ae2a16855"
            },
            {
              "path": "maintainers.json",
              "sha256": "4f17c0547e7144e9570a17c0ac61541b3f316ba4b8312fa42c5a6ef91da0ff2f"
            },
            {
              "path": "package.nix",
              "sha256": "e013668e2e124d2e87d2ea7fc242fce10d0da594f449fda1b0630b2f297d95be"
            },
            {
              "path": "patch.diff",
              "sha256": "d64c8eb1f5e5bcf82c6ad8bd704b4c6add1383ace6689e743ea9bf452c0798e9"
            },
            {
              "path": "patch-rationale.md",
              "sha256": "c0d5d267627b291ffed80672831d87dbb37149c606d284a6dab3cc0aceb7d888"
            },
            {
              "path": "upstream-fix.patch",
              "sha256": "1cd10aec04211b48e80672a2278a8ae0cfc79b63c38340640d0af83cbb1a4a00"
            }
          ],
          "outputs": [
            {
              "path": "review.md",
              "sha256": "12595aaf25afe82c7c7074afd2d0ad9831d8abf43b3e1e7afeb50d541e3fab25"
            }
          ],
          "rng_seed": null,
          "validators_passed": [
            "schema-valid-output",
            "attestation-grounded"
          ],
          "network_policy_applied": "none"
        },
        {
          "invocation_id": "ec4867d1-ffc6-4d7f-8563-62fba9f65f0d",
          "role": "reviewer",
          "started_at": "2026-06-23T18:50:41Z",
          "ended_at": "2026-06-23T18:51:18Z",
          "model": {
            "family": "anthropic",
            "vendor": "anthropic",
            "model_id": "claude-sonnet-4-5-20250929",
            "version": "sonnet-4-5-20250929",
            "sampling": {
              "temperature": 0.0,
              "top_p": 1.0,
              "max_tokens": 8192
            }
          },
          "prompt": {
            "path": "prompts/reviewer.v9.md",
            "sha256": "2ef1b9115ddaebe5b9f27b481d8b01451cf2520ec8ad8bf8a82d40bf79dc910f"
          },
          "inputs": [
            {
              "path": "finding.json",
              "sha256": "3e996f32ed4742e085d4745bd8f9cd207434cedccace69e1fd974e8cf2593466"
            },
            {
              "path": "upstream-ref.json",
              "sha256": "dab79259d5ff5a2c373a3747615b6c96043fec49cf164a29adc644681c4acaaf"
            },
            {
              "path": "impact.json",
              "sha256": "82b5b6339a392bff39d820d42811fbd5f42940c199f54d370773f61adbf2e021"
            },
            {
              "path": "maintainers.json",
              "sha256": "bfb319fe7b8518da4c399fbdc848066f384c775f6a9745157df811d495f639fd"
            },
            {
              "path": "package.nix",
              "sha256": "e013668e2e124d2e87d2ea7fc242fce10d0da594f449fda1b0630b2f297d95be"
            },
            {
              "path": "patch.diff",
              "sha256": "d64c8eb1f5e5bcf82c6ad8bd704b4c6add1383ace6689e743ea9bf452c0798e9"
            },
            {
              "path": "patch-rationale.md",
              "sha256": "c0d5d267627b291ffed80672831d87dbb37149c606d284a6dab3cc0aceb7d888"
            },
            {
              "path": "upstream-fix.patch",
              "sha256": "1cd10aec04211b48e80672a2278a8ae0cfc79b63c38340640d0af83cbb1a4a00"
            }
          ],
          "outputs": [
            {
              "path": "review.md",
              "sha256": "a53700a3eed4ea3b5f566c258f8c6d7fd305aaab574c60131f3db1e349a27ab9"
            }
          ],
          "rng_seed": null,
          "validators_passed": [
            "schema-valid-output",
            "attestation-grounded"
          ],
          "network_policy_applied": "none"
        }
      ]
    }
  ]
}
