{
  "schema_version": "1.0.0",
  "bundle_id": "7cc38be5045d8ab0",
  "cve_id": "CVE-2025-26625",
  "nixpkgs_rev": "57437f147e20d387bdfb1880053439032c99802e",
  "policy_version": "0000000000000000000000000000000000000000000000000000000000000000",
  "bundle_schema_sha256": "1111111111111111111111111111111111111111111111111111111111111111",
  "routing_config_sha256": "2222222222222222222222222222222222222222222222222222222222222222",
  "tool_manifest": {
    "flake_lock_sha256": "3333333333333333333333333333333333333333333333333333333333333333",
    "tools": [
      {
        "name": "python",
        "version": "3.13"
      },
      {
        "name": "trace-cli",
        "version": "0.0.0"
      }
    ]
  },
  "cross_family_rule_honored": true,
  "roles": [
    {
      "role": "upstream-ref-resolver",
      "invocations": [
        {
          "invocation_id": "b65e64c6-013f-4e9f-8546-f1a911a9de5d",
          "role": "upstream-ref-resolver",
          "started_at": "2026-05-17T14:56:53Z",
          "ended_at": "2026-05-17T14:56:53Z",
          "model": {
            "family": "deterministic-no-model",
            "vendor": "internal",
            "model_id": "upstream-ref-resolver-deterministic",
            "version": "1.0.0",
            "sampling": {
              "temperature": 0,
              "top_p": 1,
              "max_tokens": 1
            }
          },
          "prompt": {
            "path": "prompts/upstream-ref-resolver.v1.md",
            "sha256": "7777777777777777777777777777777777777777777777777777777777777777"
          },
          "inputs": [
            {
              "path": "finding.json",
              "sha256": "d4edf5c5e11952757c1c6341707933349fea537bc43746c2c059d3277ff9c972"
            },
            {
              "path": "resolver-input.json",
              "sha256": "b096b6ca871225d076091bafef1df807932fd75b17a3abcec27a5345acb0d488"
            }
          ],
          "outputs": [
            {
              "path": "upstream-ref.json",
              "sha256": "1bca78f1719ce373d0f7745d118366312a80be8e9647a966d4dd830092f735e3"
            }
          ],
          "rng_seed": null,
          "validators_passed": [
            "eligibility-verdict-present"
          ],
          "network_policy_applied": "feeds-only"
        }
      ]
    },
    {
      "role": "patcher",
      "invocations": [
        {
          "invocation_id": "a313fc04-2b8b-4756-b8c8-249b027d1994",
          "role": "patcher",
          "started_at": "2026-05-17T14:57:40Z",
          "ended_at": "2026-05-17T14:58:06Z",
          "model": {
            "family": "anthropic",
            "vendor": "anthropic",
            "model_id": "claude-opus-4-7",
            "version": "opus-4-7",
            "sampling": {
              "temperature": 0.0,
              "top_p": 1.0,
              "max_tokens": 8192
            }
          },
          "prompt": {
            "path": "prompts/patcher.v1.md",
            "sha256": "06272c462ac0e39befcdeef6565b80b1007b925ad5ae0fa11042baa1a6d2e322"
          },
          "inputs": [
            {
              "path": "finding.json",
              "sha256": "d4edf5c5e11952757c1c6341707933349fea537bc43746c2c059d3277ff9c972"
            },
            {
              "path": "upstream-ref.json",
              "sha256": "1bca78f1719ce373d0f7745d118366312a80be8e9647a966d4dd830092f735e3"
            },
            {
              "path": "impact.json",
              "sha256": "14846c57003cf92d78c94fc333af4a9ead5a3695d91df81d0acbe30402a74d4b"
            },
            {
              "path": "maintainers.json",
              "sha256": "16c2b1578066790585962b2bcda40fae74abfc981c09555df530f59352fcc86a"
            },
            {
              "path": "package.nix",
              "sha256": "95caa459061daec63caaaa5326a08a712a90d33d91b5dda316cd1c88095b757e"
            }
          ],
          "outputs": [
            {
              "path": "patch.diff",
              "sha256": "d4886b5abf70c38ba6da2e41e0e123f37231615976a59fb27a9b659b49e44685"
            },
            {
              "path": "patch-rationale.md",
              "sha256": "3fb71cc1108a3bbe7b8dd8c50bec3df81da8af363f25dfac932a47bce0fa5475"
            }
          ],
          "rng_seed": null,
          "validators_passed": [
            "schema-valid-output"
          ],
          "network_policy_applied": "none"
        }
      ]
    },
    {
      "role": "reproducer",
      "invocations": [
        {
          "invocation_id": "7a189ec7-27ce-463c-aef6-cf770d490ffd",
          "role": "reproducer",
          "started_at": "2026-05-17T14:58:50Z",
          "ended_at": "2026-05-17T14:59:39Z",
          "model": {
            "family": "anthropic",
            "vendor": "anthropic",
            "model_id": "claude-sonnet-4-5-20250929",
            "version": "sonnet-4-5-20250929",
            "sampling": {
              "temperature": 0.0,
              "top_p": 1.0,
              "max_tokens": 8192
            }
          },
          "prompt": {
            "path": "prompts/reproducer.v3.md",
            "sha256": "9634df849d5702fbda4c4980dc358c7965f79c9466b604c0771d25e1415b3fda"
          },
          "inputs": [
            {
              "path": "finding.json",
              "sha256": "d4edf5c5e11952757c1c6341707933349fea537bc43746c2c059d3277ff9c972"
            },
            {
              "path": "upstream-ref.json",
              "sha256": "1bca78f1719ce373d0f7745d118366312a80be8e9647a966d4dd830092f735e3"
            },
            {
              "path": "impact.json",
              "sha256": "14846c57003cf92d78c94fc333af4a9ead5a3695d91df81d0acbe30402a74d4b"
            },
            {
              "path": "maintainers.json",
              "sha256": "16c2b1578066790585962b2bcda40fae74abfc981c09555df530f59352fcc86a"
            },
            {
              "path": "package.nix",
              "sha256": "95caa459061daec63caaaa5326a08a712a90d33d91b5dda316cd1c88095b757e"
            },
            {
              "path": "patch.diff",
              "sha256": "d4886b5abf70c38ba6da2e41e0e123f37231615976a59fb27a9b659b49e44685"
            },
            {
              "path": "patch-rationale.md",
              "sha256": "3fb71cc1108a3bbe7b8dd8c50bec3df81da8af363f25dfac932a47bce0fa5475"
            }
          ],
          "outputs": [
            {
              "path": "reproducer.nix",
              "sha256": "5a86e12dfb60e095242904f2ff2ced6c09d8ed60c6b7bad940da62da51f6c33f"
            },
            {
              "path": "reproducer-log.txt",
              "sha256": "aa1fd6dd7f0745c17842f11d80dcb90a3e6a09d0365b39d1c564ea9df7121ae6"
            },
            {
              "path": "passthru-tests.json",
              "sha256": "37517e5f3dc66819f61f5a7bb8ace1921282415f10551d2defa5c3eb0985b570"
            }
          ],
          "patcher_invocation_id": "a313fc04-2b8b-4756-b8c8-249b027d1994",
          "patcher_family_recorded": "anthropic-opus",
          "cross_family_rule_honored": true,
          "rng_seed": null,
          "validators_passed": [
            "schema-valid-output"
          ],
          "network_policy_applied": "none"
        }
      ]
    },
    {
      "role": "reviewer",
      "invocations": [
        {
          "invocation_id": "d1d3fdfc-d11a-4c3d-ac63-6fbb39252262",
          "role": "reviewer",
          "started_at": "2026-06-10T23:31:05Z",
          "ended_at": "2026-06-10T23:31:16Z",
          "model": {
            "family": "anthropic",
            "vendor": "anthropic",
            "model_id": "claude-sonnet-4-5-20250929",
            "version": "sonnet-4-5-20250929",
            "sampling": {
              "temperature": 0.0,
              "top_p": 1.0,
              "max_tokens": 8192
            }
          },
          "prompt": {
            "path": "prompts/reviewer.v2.md",
            "sha256": "1b089c7e15fe0a4971347cecb0a46c4b330067c14bd19f204faf87b956a6fc68"
          },
          "inputs": [
            {
              "path": "finding.json",
              "sha256": "d4edf5c5e11952757c1c6341707933349fea537bc43746c2c059d3277ff9c972"
            },
            {
              "path": "upstream-ref.json",
              "sha256": "1bca78f1719ce373d0f7745d118366312a80be8e9647a966d4dd830092f735e3"
            },
            {
              "path": "impact.json",
              "sha256": "14846c57003cf92d78c94fc333af4a9ead5a3695d91df81d0acbe30402a74d4b"
            },
            {
              "path": "maintainers.json",
              "sha256": "16c2b1578066790585962b2bcda40fae74abfc981c09555df530f59352fcc86a"
            },
            {
              "path": "package.nix",
              "sha256": "95caa459061daec63caaaa5326a08a712a90d33d91b5dda316cd1c88095b757e"
            },
            {
              "path": "patch.diff",
              "sha256": "5ef20670ecf109db1661077736feaa075f6498868d73166c4466ce6d4c96ed61"
            },
            {
              "path": "patch-rationale.md",
              "sha256": "3fb71cc1108a3bbe7b8dd8c50bec3df81da8af363f25dfac932a47bce0fa5475"
            }
          ],
          "outputs": [
            {
              "path": "review.md",
              "sha256": "95dc6d202f1b6cd89dc8cd70eea27ea9d730c44094b41dd63723e7e985878769"
            }
          ],
          "rng_seed": null,
          "validators_passed": [
            "schema-valid-output",
            "attestation-grounded"
          ],
          "network_policy_applied": "none"
        }
      ]
    }
  ]
}
