{
  "schema_version": "1.0.0",
  "bundle_id": "06f56d82c1e42d81",
  "cve_id": "CVE-2025-15571",
  "nixpkgs_rev": "96202f2da00abe7cd65bbf02c591a6f2c765d174",
  "policy_version": "0000000000000000000000000000000000000000000000000000000000000000",
  "bundle_schema_sha256": "1111111111111111111111111111111111111111111111111111111111111111",
  "routing_config_sha256": "2222222222222222222222222222222222222222222222222222222222222222",
  "tool_manifest": {
    "flake_lock_sha256": "3333333333333333333333333333333333333333333333333333333333333333",
    "tools": [
      {
        "name": "python",
        "version": "3.13"
      },
      {
        "name": "trace-cli",
        "version": "0.0.0"
      }
    ]
  },
  "cross_family_rule_honored": true,
  "roles": [
    {
      "role": "upstream-ref-resolver",
      "invocations": [
        {
          "invocation_id": "96f8445a-d3b2-408d-85f4-ead4cb23f59b",
          "role": "upstream-ref-resolver",
          "started_at": "2026-05-23T04:53:11Z",
          "ended_at": "2026-05-23T04:53:11Z",
          "model": {
            "family": "deterministic-no-model",
            "vendor": "internal",
            "model_id": "upstream-ref-resolver-deterministic",
            "version": "1.0.0",
            "sampling": {
              "temperature": 0,
              "top_p": 1,
              "max_tokens": 1
            }
          },
          "prompt": {
            "path": "prompts/upstream-ref-resolver.v1.md",
            "sha256": "7777777777777777777777777777777777777777777777777777777777777777"
          },
          "inputs": [
            {
              "path": "finding.json",
              "sha256": "88b4b71453aa446160b901b87fefc16465a1600ec73578be98d02ad3d7fb869e"
            },
            {
              "path": "resolver-input.json",
              "sha256": "3c6fa44d504b3c18d93072600223f94d25f11635a171e038f196688a192a5a54"
            }
          ],
          "outputs": [
            {
              "path": "upstream-ref.json",
              "sha256": "f2c65f401e09dba474ba200dacd78c607646c988e87f0b2b480cb65b92dddc11"
            }
          ],
          "rng_seed": null,
          "validators_passed": [
            "eligibility-verdict-present"
          ],
          "network_policy_applied": "feeds-only"
        }
      ]
    },
    {
      "role": "patcher",
      "invocations": [
        {
          "invocation_id": "1754f5dd-7ba4-4e0d-8a6f-22df78be12a3",
          "role": "patcher",
          "started_at": "2026-05-23T04:53:39Z",
          "ended_at": "2026-05-23T04:53:57Z",
          "model": {
            "family": "anthropic",
            "vendor": "anthropic",
            "model_id": "claude-opus-4-7",
            "version": "opus-4-7",
            "sampling": {
              "temperature": 0.0,
              "top_p": 1.0,
              "max_tokens": 8192
            }
          },
          "prompt": {
            "path": "prompts/patcher.v1.md",
            "sha256": "06272c462ac0e39befcdeef6565b80b1007b925ad5ae0fa11042baa1a6d2e322"
          },
          "inputs": [
            {
              "path": "finding.json",
              "sha256": "88b4b71453aa446160b901b87fefc16465a1600ec73578be98d02ad3d7fb869e"
            },
            {
              "path": "upstream-ref.json",
              "sha256": "2649a412e76c146ebdf4008ea51ba629f4bf6c7dbdb88148f47b254f10efc53c"
            },
            {
              "path": "impact.json",
              "sha256": "35daddf36891d55ed6db0c6d51b33c840f0611ec556f3a456ea31eebb80a9cdd"
            },
            {
              "path": "maintainers.json",
              "sha256": "9b269bef3162e87d3431a1a2aacb6b164e9b0f6b0ec609adef977f040a58c652"
            },
            {
              "path": "package.nix",
              "sha256": "24678d583c3ac88d98f60acf0847689a0eeb4f1bdbf56178aa6144429fc3a04e"
            }
          ],
          "outputs": [
            {
              "path": "patch.diff",
              "sha256": "896e2178816810ada8d4d739f09ba078ac6ce74c0b972d89e8574011ea637bd6"
            },
            {
              "path": "patch-rationale.md",
              "sha256": "d1d071220c00661dd24f97c8537f5e122ccd1a91ac75d245df2527eb52b379b0"
            }
          ],
          "rng_seed": null,
          "validators_passed": [
            "schema-valid-output"
          ],
          "network_policy_applied": "none"
        }
      ]
    },
    {
      "role": "reviewer",
      "invocations": [
        {
          "invocation_id": "ffa14fcc-a5f4-44e4-9dab-3c2eb2107e9d",
          "role": "reviewer",
          "started_at": "2026-05-23T04:58:42Z",
          "ended_at": "2026-05-23T04:58:54Z",
          "model": {
            "family": "anthropic",
            "vendor": "anthropic",
            "model_id": "claude-sonnet-4-5-20250929",
            "version": "sonnet-4-5-20250929",
            "sampling": {
              "temperature": 0.0,
              "top_p": 1.0,
              "max_tokens": 8192
            }
          },
          "prompt": {
            "path": "prompts/reviewer.v2.md",
            "sha256": "1b089c7e15fe0a4971347cecb0a46c4b330067c14bd19f204faf87b956a6fc68"
          },
          "inputs": [
            {
              "path": "finding.json",
              "sha256": "88b4b71453aa446160b901b87fefc16465a1600ec73578be98d02ad3d7fb869e"
            },
            {
              "path": "upstream-ref.json",
              "sha256": "2649a412e76c146ebdf4008ea51ba629f4bf6c7dbdb88148f47b254f10efc53c"
            },
            {
              "path": "impact.json",
              "sha256": "35daddf36891d55ed6db0c6d51b33c840f0611ec556f3a456ea31eebb80a9cdd"
            },
            {
              "path": "maintainers.json",
              "sha256": "9b269bef3162e87d3431a1a2aacb6b164e9b0f6b0ec609adef977f040a58c652"
            },
            {
              "path": "package.nix",
              "sha256": "24678d583c3ac88d98f60acf0847689a0eeb4f1bdbf56178aa6144429fc3a04e"
            },
            {
              "path": "patch.diff",
              "sha256": "896e2178816810ada8d4d739f09ba078ac6ce74c0b972d89e8574011ea637bd6"
            },
            {
              "path": "patch-rationale.md",
              "sha256": "d1d071220c00661dd24f97c8537f5e122ccd1a91ac75d245df2527eb52b379b0"
            }
          ],
          "outputs": [
            {
              "path": "review.md",
              "sha256": "29be834be52c8c7447ddd2f8b66b1cfa81f49d200f8f419ca82a33264c08ce47"
            }
          ],
          "rng_seed": null,
          "validators_passed": [
            "schema-valid-output",
            "attestation-grounded"
          ],
          "network_policy_applied": "none"
        }
      ]
    },
    {
      "role": "reproducer",
      "invocations": [
        {
          "invocation_id": "de446358-da30-4817-be20-a753e306bb98",
          "role": "reproducer",
          "started_at": "2026-05-24T00:02:35Z",
          "ended_at": "2026-05-24T00:03:16Z",
          "model": {
            "family": "anthropic",
            "vendor": "anthropic",
            "model_id": "claude-sonnet-4-5-20250929",
            "version": "sonnet-4-5-20250929",
            "sampling": {
              "temperature": 0.0,
              "top_p": 1.0,
              "max_tokens": 8192
            }
          },
          "prompt": {
            "path": "prompts/reproducer.v8.md",
            "sha256": "b2064b7ee8d302faf73acdbb94d80549c74a216b122bdf1750f489a59fa389f0"
          },
          "inputs": [
            {
              "path": "finding.json",
              "sha256": "88b4b71453aa446160b901b87fefc16465a1600ec73578be98d02ad3d7fb869e"
            },
            {
              "path": "upstream-ref.json",
              "sha256": "2649a412e76c146ebdf4008ea51ba629f4bf6c7dbdb88148f47b254f10efc53c"
            },
            {
              "path": "impact.json",
              "sha256": "35daddf36891d55ed6db0c6d51b33c840f0611ec556f3a456ea31eebb80a9cdd"
            },
            {
              "path": "maintainers.json",
              "sha256": "9b269bef3162e87d3431a1a2aacb6b164e9b0f6b0ec609adef977f040a58c652"
            },
            {
              "path": "package.nix",
              "sha256": "24678d583c3ac88d98f60acf0847689a0eeb4f1bdbf56178aa6144429fc3a04e"
            },
            {
              "path": "patch.diff",
              "sha256": "896e2178816810ada8d4d739f09ba078ac6ce74c0b972d89e8574011ea637bd6"
            },
            {
              "path": "patch-rationale.md",
              "sha256": "d1d071220c00661dd24f97c8537f5e122ccd1a91ac75d245df2527eb52b379b0"
            }
          ],
          "outputs": [
            {
              "path": "reproducer.nix",
              "sha256": "27a66a92dbb0a0196009d382e910ff60b2fb670bd0ac5aacaa9549f8a6179bb0"
            },
            {
              "path": "reproducer-log.txt",
              "sha256": "3dab568154707b8b39077f95437cc853e888720a72df0824bd10ead3ca4814ca"
            },
            {
              "path": "passthru-tests.json",
              "sha256": "37517e5f3dc66819f61f5a7bb8ace1921282415f10551d2defa5c3eb0985b570"
            }
          ],
          "patcher_invocation_id": "1754f5dd-7ba4-4e0d-8a6f-22df78be12a3",
          "patcher_family_recorded": "anthropic-opus",
          "cross_family_rule_honored": true,
          "rng_seed": null,
          "validators_passed": [
            "schema-valid-output"
          ],
          "network_policy_applied": "none"
        }
      ]
    }
  ]
}
