{
  "schema_version": "1.0.0",
  "bundle_id": "0000000000000012",
  "cve_id": "CVE-0000-0012",
  "nixpkgs_rev": "0000000000000000000000000000000000000000",
  "policy_version": "0000000000000000000000000000000000000000000000000000000000000000",
  "bundle_schema_sha256": "1111111111111111111111111111111111111111111111111111111111111111",
  "routing_config_sha256": "2222222222222222222222222222222222222222222222222222222222222222",
  "tool_manifest": {
    "flake_lock_sha256": "3333333333333333333333333333333333333333333333333333333333333333",
    "tools": [
      {
        "name": "python",
        "version": "3.13"
      },
      {
        "name": "trace-cli",
        "version": "0.0.0"
      }
    ]
  },
  "cross_family_rule_honored": true,
  "roles": [
    {
      "role": "upstream-ref-resolver",
      "invocations": [
        {
          "invocation_id": "00000000-0000-4000-8000-000000000010",
          "role": "upstream-ref-resolver",
          "started_at": "2026-04-23T00:00:00Z",
          "ended_at": "2026-04-23T00:00:01Z",
          "model": {
            "family": "deterministic-no-model",
            "vendor": "internal",
            "model_id": "upstream-ref-resolver-deterministic",
            "version": "1.0.0",
            "sampling": {
              "temperature": 0,
              "top_p": 1,
              "max_tokens": 1
            }
          },
          "prompt": {
            "path": "prompts/upstream-ref-resolver.v1.md",
            "sha256": "7777777777777777777777777777777777777777777777777777777777777777"
          },
          "inputs": [
            {
              "path": "finding.json",
              "sha256": "6666666666666666666666666666666666666666666666666666666666666666"
            }
          ],
          "outputs": [
            {
              "path": "upstream-ref.json",
              "sha256": "8888888888888888888888888888888888888888888888888888888888888888"
            }
          ],
          "rng_seed": null,
          "validators_passed": [
            "eligibility-verdict-present"
          ],
          "network_policy_applied": "feeds-only"
        }
      ]
    }
  ]
}