{
  "schema_version": "1.0.0",
  "bundle_id": "615fa8a51ec591e3",
  "cve_id": "CVE-2026-34080",
  "nixpkgs_rev": "77bb0683a4d1cd66d08ccfe62a851e1068fbd23a",
  "policy_version": "0000000000000000000000000000000000000000000000000000000000000000",
  "bundle_schema_sha256": "1111111111111111111111111111111111111111111111111111111111111111",
  "routing_config_sha256": "2222222222222222222222222222222222222222222222222222222222222222",
  "tool_manifest": {
    "flake_lock_sha256": "3333333333333333333333333333333333333333333333333333333333333333",
    "tools": [
      {
        "name": "python",
        "version": "3.13"
      },
      {
        "name": "trace-cli",
        "version": "0.0.0"
      }
    ]
  },
  "cross_family_rule_honored": true,
  "roles": [
    {
      "role": "upstream-ref-resolver",
      "invocations": [
        {
          "invocation_id": "00000000-0000-4000-8000-000000000000",
          "role": "upstream-ref-resolver",
          "started_at": "2026-04-27T00:00:00Z",
          "ended_at": "2026-04-27T00:00:01Z",
          "model": {
            "family": "deterministic-no-model",
            "vendor": "internal",
            "model_id": "upstream-ref-resolver-deterministic",
            "version": "1.0.0",
            "sampling": {
              "temperature": 0,
              "top_p": 1,
              "max_tokens": 1
            }
          },
          "prompt": {
            "path": "prompts/upstream-ref-resolver.v1.md",
            "sha256": "7777777777777777777777777777777777777777777777777777777777777777"
          },
          "inputs": [
            {
              "path": "finding.json",
              "sha256": "5bf71cd34fd41cfd325c201d2fb76222595d18d447a4fab12ac6451753fc96f6"
            }
          ],
          "outputs": [
            {
              "path": "upstream-ref.json",
              "sha256": "c45e3f1949d19cb4293edea4f6f9dc9a53b0544d12a2804428268cead591815c"
            }
          ],
          "rng_seed": null,
          "validators_passed": [
            "eligibility-verdict-present"
          ],
          "network_policy_applied": "feeds-only"
        }
      ]
    },
    {
      "role": "patcher",
      "invocations": [
        {
          "invocation_id": "7ed717e9-757d-4a9d-98c5-e9cad02aafe1",
          "role": "patcher",
          "started_at": "2026-06-15T16:59:07Z",
          "ended_at": "2026-06-15T16:59:28Z",
          "model": {
            "family": "anthropic",
            "vendor": "anthropic",
            "model_id": "claude-opus-4-7",
            "version": "opus-4-7",
            "sampling": {
              "temperature": 0.0,
              "top_p": 1.0,
              "max_tokens": 8192
            }
          },
          "prompt": {
            "path": "prompts/patcher.v2.2.md",
            "sha256": "bfb5532d3b9fa63dd64c038d0e9c989d5bc007db50f5573f0c16a9dbff95f703"
          },
          "inputs": [
            {
              "path": "finding.json",
              "sha256": "5bf71cd34fd41cfd325c201d2fb76222595d18d447a4fab12ac6451753fc96f6"
            },
            {
              "path": "upstream-ref.json",
              "sha256": "c45e3f1949d19cb4293edea4f6f9dc9a53b0544d12a2804428268cead591815c"
            },
            {
              "path": "impact.json",
              "sha256": "6c7289c66dd4eb223325b3a1dfa56b18fc8728e41493544a6be390441a5d9c70"
            },
            {
              "path": "maintainers.json",
              "sha256": "c5f4a54608e34629fc3d31d21e610a5cc8bfa718d3f2608e213bfe572d004389"
            },
            {
              "path": "package.nix",
              "sha256": "2596e95e10ab0c0dd681044360b8d4fc21023d65ddb5033a281f3b3f7bdcd27f"
            }
          ],
          "outputs": [
            {
              "path": "patch.diff",
              "sha256": "62dd73219215327e2efbc58ed6e9ef38b53368784282d742bbd0eb458d44dab9"
            },
            {
              "path": "patch-rationale.md",
              "sha256": "d3583d3b6f0734d953952cfaf3b6b203bc6f75a1529e0c4cdd7f544913c69cd3"
            }
          ],
          "rng_seed": null,
          "validators_passed": [
            "schema-valid-output"
          ],
          "network_policy_applied": "none"
        }
      ]
    },
    {
      "role": "reviewer",
      "invocations": [
        {
          "invocation_id": "0ea65f3e-f2d2-4c15-acb6-fb578888e9f5",
          "role": "reviewer",
          "started_at": "2026-06-15T16:59:28Z",
          "ended_at": "2026-06-15T16:59:38Z",
          "model": {
            "family": "anthropic",
            "vendor": "anthropic",
            "model_id": "claude-sonnet-4-5-20250929",
            "version": "sonnet-4-5-20250929",
            "sampling": {
              "temperature": 0.0,
              "top_p": 1.0,
              "max_tokens": 8192
            }
          },
          "prompt": {
            "path": "prompts/reviewer.v2.md",
            "sha256": "1b089c7e15fe0a4971347cecb0a46c4b330067c14bd19f204faf87b956a6fc68"
          },
          "inputs": [
            {
              "path": "finding.json",
              "sha256": "5bf71cd34fd41cfd325c201d2fb76222595d18d447a4fab12ac6451753fc96f6"
            },
            {
              "path": "upstream-ref.json",
              "sha256": "c45e3f1949d19cb4293edea4f6f9dc9a53b0544d12a2804428268cead591815c"
            },
            {
              "path": "impact.json",
              "sha256": "6c7289c66dd4eb223325b3a1dfa56b18fc8728e41493544a6be390441a5d9c70"
            },
            {
              "path": "maintainers.json",
              "sha256": "c5f4a54608e34629fc3d31d21e610a5cc8bfa718d3f2608e213bfe572d004389"
            },
            {
              "path": "package.nix",
              "sha256": "2596e95e10ab0c0dd681044360b8d4fc21023d65ddb5033a281f3b3f7bdcd27f"
            },
            {
              "path": "patch.diff",
              "sha256": "62dd73219215327e2efbc58ed6e9ef38b53368784282d742bbd0eb458d44dab9"
            },
            {
              "path": "patch-rationale.md",
              "sha256": "d3583d3b6f0734d953952cfaf3b6b203bc6f75a1529e0c4cdd7f544913c69cd3"
            }
          ],
          "outputs": [
            {
              "path": "review.md",
              "sha256": "909582de90c5b7b484d15f9c6cdde44ab56c0d68a05be2970bfa02db26771b98"
            }
          ],
          "rng_seed": null,
          "validators_passed": [
            "schema-valid-output",
            "attestation-grounded"
          ],
          "network_policy_applied": "none"
        }
      ]
    },
    {
      "role": "reproducer",
      "invocations": [
        {
          "invocation_id": "f44c5359-8104-42f8-9753-699ade953e85",
          "role": "reproducer",
          "started_at": "2026-06-15T16:59:38Z",
          "ended_at": "2026-06-15T16:59:48Z",
          "model": {
            "family": "anthropic",
            "vendor": "anthropic",
            "model_id": "claude-sonnet-4-5-20250929",
            "version": "sonnet-4-5-20250929",
            "sampling": {
              "temperature": 0.0,
              "top_p": 1.0,
              "max_tokens": 8192
            }
          },
          "prompt": {
            "path": "prompts/reproducer.v13.md",
            "sha256": "b9c693a12d1dd5c7ecd5d7ed43e4be171a6700a818a923dbbc672d4b6609d7a7"
          },
          "inputs": [
            {
              "path": "finding.json",
              "sha256": "5bf71cd34fd41cfd325c201d2fb76222595d18d447a4fab12ac6451753fc96f6"
            },
            {
              "path": "upstream-ref.json",
              "sha256": "c45e3f1949d19cb4293edea4f6f9dc9a53b0544d12a2804428268cead591815c"
            },
            {
              "path": "impact.json",
              "sha256": "6c7289c66dd4eb223325b3a1dfa56b18fc8728e41493544a6be390441a5d9c70"
            },
            {
              "path": "maintainers.json",
              "sha256": "c5f4a54608e34629fc3d31d21e610a5cc8bfa718d3f2608e213bfe572d004389"
            },
            {
              "path": "package.nix",
              "sha256": "2596e95e10ab0c0dd681044360b8d4fc21023d65ddb5033a281f3b3f7bdcd27f"
            },
            {
              "path": "patch.diff",
              "sha256": "62dd73219215327e2efbc58ed6e9ef38b53368784282d742bbd0eb458d44dab9"
            },
            {
              "path": "patch-rationale.md",
              "sha256": "d3583d3b6f0734d953952cfaf3b6b203bc6f75a1529e0c4cdd7f544913c69cd3"
            }
          ],
          "outputs": [
            {
              "path": "reproducer-refusal.json",
              "sha256": "762bf8919566259ade9d1f6b8fddd2a46951dc21a6e447ba713ab1c6cd6cf174"
            }
          ],
          "patcher_invocation_id": "7ed717e9-757d-4a9d-98c5-e9cad02aafe1",
          "patcher_family_recorded": "anthropic-opus",
          "cross_family_rule_honored": true,
          "rng_seed": null,
          "validators_passed": [
            "refusal-shape"
          ],
          "network_policy_applied": "none"
        }
      ]
    }
  ]
}
